{
  "protocol": "QSOL-THOTH/ESS-SESSION/1",
  "schema_version": "1.0.0",
  "session_id": "demonstrated_hysteresis_session",
  "profile_id": "demonstrated_hysteresis",
  "events": [
    {
      "sequence": 1,
      "event_id": "event-001",
      "kind": "route",
      "request": {
        "protocol": "QSOL-THOTH/ROUTE-REQUEST/1",
        "intent": "general"
      }
    },
    {
      "sequence": 2,
      "event_id": "event-002",
      "kind": "transition",
      "target_style": "australian_humour"
    },
    {
      "sequence": 3,
      "event_id": "event-003",
      "kind": "transition",
      "target_style": "australian_humour"
    },
    {
      "sequence": 4,
      "event_id": "event-004",
      "kind": "transition",
      "target_style": "research"
    },
    {
      "sequence": 5,
      "event_id": "event-005",
      "kind": "route",
      "request": {
        "protocol": "QSOL-THOTH/ROUTE-REQUEST/1",
        "intent": "formal_claim"
      }
    },
    {
      "sequence": 6,
      "event_id": "event-006",
      "kind": "transition",
      "target_style": "research"
    },
    {
      "sequence": 7,
      "event_id": "event-007",
      "kind": "transition",
      "target_style": "research"
    },
    {
      "sequence": 8,
      "event_id": "event-008",
      "kind": "route",
      "request": {
        "protocol": "QSOL-THOTH/ROUTE-REQUEST/1",
        "intent": "historical_reconstruction"
      }
    },
    {
      "sequence": 9,
      "event_id": "event-009",
      "kind": "reset"
    },
    {
      "sequence": 10,
      "event_id": "event-010",
      "kind": "route",
      "request": {
        "protocol": "QSOL-THOTH/ROUTE-REQUEST/1",
        "intent": "comedy"
      }
    }
  ],
  "boundaries": [
    "STYLE_SWITCH != EPISTEMIC_SWITCH",
    "STYLE_PERSISTENCE != EPISTEMIC_PERSISTENCE",
    "EXPLICIT_STYLE_TRANSITION != MODEL_INFERENCE",
    "ROUTE_DEFAULT != FORCED_SESSION_TRANSITION",
    "HYSTERESIS != AMBIGUITY",
    "DWELL_COUNT != WALL_CLOCK_TIME",
    "REPLAY_RECEIPT != HIDDEN_STATE"
  ]
}
